{
  "domain": "airports",
  "pack_id": "airport-terminal-access",
  "version": "1.0.0",
  "lifecycle": "published",
  "nodes": [
    {
      "id": "input",
      "type": "inputNode",
      "name": "Passage",
      "position": { "x": 80, "y": 200 },
      "content": { "schema": "" }
    },
    {
      "id": "lanes",
      "type": "decisionTableNode",
      "name": "Terminal & security lane",
      "position": { "x": 380, "y": 200 },
      "content": {
        "hitPolicy": "first",
        "inputs": [
          { "id": "i1", "name": "Tier", "field": "membership.tier" },
          { "id": "i2", "name": "Cabin", "field": "booking.cabin" },
          { "id": "i3", "name": "Airport", "field": "airport.code" }
        ],
        "outputs": [
          { "id": "o1", "name": "Decision", "field": "decision" },
          { "id": "o2", "name": "Effect", "field": "effect_type" },
          { "id": "o3", "name": "Lane", "field": "security_lane" },
          { "id": "o4", "name": "Terminal", "field": "terminal" },
          { "id": "o5", "name": "Benefit", "field": "benefit_type" },
          { "id": "o6", "name": "Persist", "field": "persist_as_entitlement" },
          { "id": "o7", "name": "Reason", "field": "reason" },
          { "id": "o8", "name": "Rule id", "field": "rule_id" }
        ],
        "rules": [
          {
            "_id": "syd-p1",
            "i1": "'platinum_one'",
            "i2": "",
            "i3": "'SYD'",
            "o1": "\"allow\"",
            "o2": "\"grant_access\"",
            "o3": "\"fast_track\"",
            "o4": "\"T1\"",
            "o5": "null",
            "o6": "false",
            "o7": "\"p1_fast_track\"",
            "o8": "\"syd-p1\""
          },
          {
            "_id": "first-cabin-lane",
            "i1": "",
            "i2": "'first', 'business'",
            "i3": "",
            "o1": "\"allow\"",
            "o2": "\"grant_access\"",
            "o3": "\"priority\"",
            "o4": "\"premium\"",
            "o5": "null",
            "o6": "false",
            "o7": "\"cabin_lane\"",
            "o8": "\"first-cabin-lane\""
          },
          {
            "_id": "gold-plus",
            "i1": "'gold', 'platinum', 'platinum_one'",
            "i2": "",
            "i3": "",
            "o1": "\"allow\"",
            "o2": "\"grant_access\"",
            "o3": "\"priority\"",
            "o4": "\"standard\"",
            "o5": "null",
            "o6": "false",
            "o7": "\"status_lane\"",
            "o8": "\"gold-plus\""
          },
          {
            "_id": "standard-lane",
            "i1": "",
            "i2": "",
            "i3": "",
            "o1": "\"allow\"",
            "o2": "\"grant_access\"",
            "o3": "\"standard\"",
            "o4": "\"standard\"",
            "o5": "null",
            "o6": "false",
            "o7": "\"default_lane\"",
            "o8": "\"standard-lane\""
          }
        ],
        "passThrough": false,
        "inputField": null,
        "outputPath": "matches",
        "executionMode": "single"
      }
    },
    {
      "id": "output",
      "type": "outputNode",
      "name": "Gate pass",
      "position": { "x": 700, "y": 200 },
      "content": { "schema": "" }
    }
  ],
  "edges": [
    { "id": "e1", "sourceId": "input", "type": "edge", "targetId": "lanes" },
    { "id": "e2", "sourceId": "lanes", "type": "edge", "targetId": "output" }
  ]
}
