{
  "domain": "lounge",
  "pack_id": "lounge-access",
  "version": "1.0.0",
  "lifecycle": "published",
  "nodes": [
    {
      "id": "input",
      "type": "inputNode",
      "name": "Request",
      "position": { "x": 80, "y": 220 },
      "content": { "schema": "" }
    },
    {
      "id": "eligibility",
      "type": "decisionTableNode",
      "name": "Lounge eligibility",
      "position": { "x": 360, "y": 220 },
      "content": {
        "hitPolicy": "collect",
        "inputs": [
          { "id": "i1", "name": "Tier", "field": "membership.tier" },
          { "id": "i2", "name": "Partner elite", "field": "partner.elite_tier" },
          { "id": "i3", "name": "Companion eligible", "field": "membership.companion_eligible" },
          { "id": "i4", "name": "As of", "field": "as_of" }
        ],
        "outputs": [
          { "id": "o1", "name": "Decision", "field": "decision" },
          { "id": "o2", "name": "Effect type", "field": "effect_type" },
          { "id": "o3", "name": "Lounge class", "field": "lounge_class" },
          { "id": "o4", "name": "Benefit type", "field": "benefit_type" },
          { "id": "o5", "name": "Persist entitlement", "field": "persist_as_entitlement" },
          { "id": "o6", "name": "Reason", "field": "reason" },
          { "id": "o7", "name": "Companions", "field": "companions_allowed" },
          { "id": "o8", "name": "Rule id", "field": "rule_id" },
          { "id": "o9", "name": "Via", "field": "via" }
        ],
        "rules": [
          {
            "_id": "tier-gold-lounge",
            "i1": "'gold', 'platinum', 'diamond'",
            "i2": "",
            "i3": "",
            "i4": "",
            "o1": "\"allow\"",
            "o2": "\"allow\"",
            "o3": "\"domestic\"",
            "o4": "null",
            "o5": "false",
            "o6": "\"tier_access\"",
            "o7": "null",
            "o8": "\"tier-gold-lounge\"",
            "o9": "null"
          },
          {
            "_id": "tier-gold-grant",
            "i1": "'gold', 'platinum', 'diamond'",
            "i2": "",
            "i3": "",
            "i4": "",
            "o1": "\"allow\"",
            "o2": "\"grant_access\"",
            "o3": "\"domestic\"",
            "o4": "\"lounge_access\"",
            "o5": "true",
            "o6": "\"tier_access\"",
            "o7": "null",
            "o8": "\"tier-gold-lounge\"",
            "o9": "null"
          },
          {
            "_id": "partner-elite-allow",
            "i1": "",
            "i2": "'gold', 'platinum', 'first'",
            "i3": "",
            "i4": "",
            "o1": "\"allow\"",
            "o2": "\"allow\"",
            "o3": "\"domestic\"",
            "o4": "null",
            "o5": "false",
            "o6": "\"partner_elite\"",
            "o7": "null",
            "o8": "\"partner-elite-access\"",
            "o9": "\"partner\""
          },
          {
            "_id": "partner-elite-grant",
            "i1": "",
            "i2": "'gold', 'platinum', 'first'",
            "i3": "",
            "i4": "",
            "o1": "\"allow\"",
            "o2": "\"grant_access\"",
            "o3": "\"domestic\"",
            "o4": "\"lounge_access\"",
            "o5": "true",
            "o6": "\"partner_elite\"",
            "o7": "null",
            "o8": "\"partner-elite-access\"",
            "o9": "\"partner\""
          },
          {
            "_id": "companion-tier",
            "i1": "'platinum', 'diamond'",
            "i2": "",
            "i3": "",
            "i4": "",
            "o1": "\"allow\"",
            "o2": "\"grant_access\"",
            "o3": "null",
            "o4": "\"companion_pass\"",
            "o5": "true",
            "o6": "\"companion\"",
            "o7": "1",
            "o8": "\"companion-plus-one\"",
            "o9": "null"
          },
          {
            "_id": "companion-flag",
            "i1": "",
            "i2": "",
            "i3": "true",
            "i4": "",
            "o1": "\"allow\"",
            "o2": "\"grant_access\"",
            "o3": "null",
            "o4": "\"companion_pass\"",
            "o5": "true",
            "o6": "\"companion\"",
            "o7": "1",
            "o8": "\"companion-plus-one\"",
            "o9": "null"
          },
          {
            "_id": "seasonal-peak-deny-silver",
            "i1": "'silver'",
            "i2": "",
            "i3": "",
            "i4": ">= date('2099-01-01') and < date('2100-01-01')",
            "o1": "\"deny\"",
            "o2": "\"deny\"",
            "o3": "null",
            "o4": "null",
            "o5": "false",
            "o6": "\"peak_season_restriction\"",
            "o7": "null",
            "o8": "\"seasonal-peak-deny-silver\"",
            "o9": "null"
          }
        ],
        "passThrough": false,
        "inputField": null,
        "outputPath": "matches",
        "executionMode": "single"
      }
    },
    {
      "id": "output",
      "type": "outputNode",
      "name": "Response",
      "position": { "x": 720, "y": 220 },
      "content": { "schema": "" }
    }
  ],
  "edges": [
    {
      "id": "e-input-eligibility",
      "sourceId": "input",
      "type": "edge",
      "targetId": "eligibility"
    },
    {
      "id": "e-eligibility-output",
      "sourceId": "eligibility",
      "type": "edge",
      "targetId": "output"
    }
  ]
}
